{
  "schemaVersion": "1.0.0",
  "metric": "arrivals_germany",
  "geo": "MV",
  "freq": "A",
  "unit": "arrivals",
  "points": [
    {
      "ds": "1988-01-01",
      "y": 40855.0
    },
    {
      "ds": "1989-01-01",
      "y": 36048.0
    },
    {
      "ds": "1990-01-01",
      "y": 41728.0
    },
    {
      "ds": "1991-01-01",
      "y": 45422.0
    },
    {
      "ds": "1992-01-01",
      "y": 52141.0
    },
    {
      "ds": "1993-01-01",
      "y": 60693.0
    },
    {
      "ds": "1994-01-01",
      "y": 66980.0
    },
    {
      "ds": "1995-01-01",
      "y": 72326.0
    },
    {
      "ds": "1996-01-01",
      "y": 74688.0
    },
    {
      "ds": "1997-01-01",
      "y": 76073.0
    },
    {
      "ds": "1998-01-01",
      "y": 76317.0
    },
    {
      "ds": "1999-01-01",
      "y": 86497.0
    },
    {
      "ds": "2000-01-01",
      "y": 77642.0
    },
    {
      "ds": "2001-01-01",
      "y": 66149.0
    },
    {
      "ds": "2002-01-01",
      "y": 63212.0
    },
    {
      "ds": "2003-01-01",
      "y": 70762.0
    },
    {
      "ds": "2004-01-01",
      "y": 72967.0
    },
    {
      "ds": "2005-01-01",
      "y": 55782.0
    },
    {
      "ds": "2006-01-01",
      "y": 70830.0
    },
    {
      "ds": "2007-01-01",
      "y": 72269.0
    },
    {
      "ds": "2008-01-01",
      "y": 69240.0
    },
    {
      "ds": "2009-01-01",
      "y": 69085.0
    },
    {
      "ds": "2010-01-01",
      "y": 77108.0
    },
    {
      "ds": "2011-01-01",
      "y": 90517.0
    },
    {
      "ds": "2012-01-01",
      "y": 98351.0
    },
    {
      "ds": "2013-01-01",
      "y": 93598.0
    },
    {
      "ds": "2014-01-01",
      "y": 98328.0
    },
    {
      "ds": "2015-01-01",
      "y": 105132.0
    },
    {
      "ds": "2016-01-01",
      "y": 106381.0
    },
    {
      "ds": "2017-01-01",
      "y": 112109.0
    },
    {
      "ds": "2018-01-01",
      "y": 117532.0
    },
    {
      "ds": "2019-01-01",
      "y": 131561.0
    },
    {
      "ds": "2020-01-01",
      "y": 36435.0
    },
    {
      "ds": "2021-01-01",
      "y": 95358.0
    },
    {
      "ds": "2022-01-01",
      "y": 133432.0
    },
    {
      "ds": "2023-01-01",
      "y": 135091.0
    },
    {
      "ds": "2024-01-01",
      "y": 157246.0
    },
    {
      "ds": "2025-01-01",
      "y": 167822.0
    }
  ],
  "lineage": {
    "runId": "0edddd48-088a-4298-9293-bda8fba914e2",
    "gitSha": "47d557c",
    "inputHash": "sha256:7ede0e55bc4312bfb80548ecd8d0d3773106789f889eb0ff80773a6f3eded851"
  }
}
