{
  "schemaVersion": "1.0.0",
  "metric": "arrivals_india",
  "geo": "MV",
  "freq": "A",
  "unit": "arrivals",
  "points": [
    {
      "ds": "1988-01-01",
      "y": 8336.0
    },
    {
      "ds": "1989-01-01",
      "y": 5701.0
    },
    {
      "ds": "1990-01-01",
      "y": 7423.0
    },
    {
      "ds": "1991-01-01",
      "y": 8048.0
    },
    {
      "ds": "1992-01-01",
      "y": 7805.0
    },
    {
      "ds": "1993-01-01",
      "y": 10890.0
    },
    {
      "ds": "1994-01-01",
      "y": 11623.0
    },
    {
      "ds": "1995-01-01",
      "y": 12653.0
    },
    {
      "ds": "1996-01-01",
      "y": 10239.0
    },
    {
      "ds": "1997-01-01",
      "y": 12106.0
    },
    {
      "ds": "1998-01-01",
      "y": 11734.0
    },
    {
      "ds": "1999-01-01",
      "y": 11621.0
    },
    {
      "ds": "2000-01-01",
      "y": 10616.0
    },
    {
      "ds": "2001-01-01",
      "y": 8511.0
    },
    {
      "ds": "2002-01-01",
      "y": 11377.0
    },
    {
      "ds": "2003-01-01",
      "y": 11502.0
    },
    {
      "ds": "2004-01-01",
      "y": 10999.0
    },
    {
      "ds": "2005-01-01",
      "y": 10260.0
    },
    {
      "ds": "2006-01-01",
      "y": 12071.0
    },
    {
      "ds": "2007-01-01",
      "y": 17327.0
    },
    {
      "ds": "2008-01-01",
      "y": 16663.0
    },
    {
      "ds": "2009-01-01",
      "y": 15850.0
    },
    {
      "ds": "2010-01-01",
      "y": 25756.0
    },
    {
      "ds": "2011-01-01",
      "y": 30978.0
    },
    {
      "ds": "2012-01-01",
      "y": 31721.0
    },
    {
      "ds": "2013-01-01",
      "y": 38014.0
    },
    {
      "ds": "2014-01-01",
      "y": 45587.0
    },
    {
      "ds": "2015-01-01",
      "y": 52368.0
    },
    {
      "ds": "2016-01-01",
      "y": 66955.0
    },
    {
      "ds": "2017-01-01",
      "y": 83019.0
    },
    {
      "ds": "2018-01-01",
      "y": 90474.0
    },
    {
      "ds": "2019-01-01",
      "y": 166030.0
    },
    {
      "ds": "2020-01-01",
      "y": 62960.0
    },
    {
      "ds": "2021-01-01",
      "y": 291787.0
    },
    {
      "ds": "2022-01-01",
      "y": 241382.0
    },
    {
      "ds": "2023-01-01",
      "y": 209193.0
    },
    {
      "ds": "2024-01-01",
      "y": 130805.0
    },
    {
      "ds": "2025-01-01",
      "y": 131625.0
    }
  ],
  "lineage": {
    "runId": "1aa9286f-7697-434b-a014-b4cf4e4fae45",
    "gitSha": "47d557c",
    "inputHash": "sha256:57ef375d4fd0dbcde1e94b0c8be85b5e40a479a898620cc847e676cf4ed0ba94"
  }
}
