{
  "schemaVersion": "1.0.0",
  "metric": "bednights_hotels",
  "geo": "MV",
  "freq": "A",
  "unit": "bednights",
  "points": [
    {
      "ds": "2000-01-01",
      "y": 54408.0
    },
    {
      "ds": "2001-01-01",
      "y": 69352.0
    },
    {
      "ds": "2002-01-01",
      "y": 78147.0
    },
    {
      "ds": "2003-01-01",
      "y": 86929.0
    },
    {
      "ds": "2004-01-01",
      "y": 123631.0
    },
    {
      "ds": "2005-01-01",
      "y": 104145.0
    },
    {
      "ds": "2006-01-01",
      "y": 114839.0
    },
    {
      "ds": "2007-01-01",
      "y": 144895.0
    },
    {
      "ds": "2008-01-01",
      "y": 161640.0
    },
    {
      "ds": "2009-01-01",
      "y": 141877.0
    },
    {
      "ds": "2010-01-01",
      "y": 184101.0
    },
    {
      "ds": "2011-01-01",
      "y": 213603.0
    },
    {
      "ds": "2012-01-01",
      "y": 178152.0
    },
    {
      "ds": "2013-01-01",
      "y": 203458.0
    },
    {
      "ds": "2014-01-01",
      "y": 223717.0
    },
    {
      "ds": "2015-01-01",
      "y": 204439.0
    },
    {
      "ds": "2016-01-01",
      "y": 216842.0
    },
    {
      "ds": "2017-01-01",
      "y": 241843.6231966608
    },
    {
      "ds": "2018-01-01",
      "y": 255389.18203142448
    },
    {
      "ds": "2019-01-01",
      "y": 285763.8748580196
    },
    {
      "ds": "2020-01-01",
      "y": 100047.94144871892
    },
    {
      "ds": "2021-01-01",
      "y": 213230.18145655695
    },
    {
      "ds": "2022-01-01",
      "y": 202503.65704769304
    },
    {
      "ds": "2023-01-01",
      "y": 224951.74479365774
    },
    {
      "ds": "2024-01-01",
      "y": 204641.056117013
    },
    {
      "ds": "2025-01-01",
      "y": 267885.56589962536
    }
  ],
  "lineage": {
    "runId": "16fe86d1-161d-4ebb-83e1-3c9fd7127752",
    "gitSha": "d73b74c",
    "inputHash": "sha256:1cbdc0d397211c1fb3cdc35f56ec4ce2bec0b8e3eee1d026831688e34241e54a"
  }
}
