{
  "schemaVersion": "1.0.0",
  "metric": "arrivals_uk",
  "geo": "MV",
  "freq": "A",
  "unit": "arrivals",
  "points": [
    {
      "ds": "1988-01-01",
      "y": 10406.0
    },
    {
      "ds": "1989-01-01",
      "y": 15855.0
    },
    {
      "ds": "1990-01-01",
      "y": 22684.0
    },
    {
      "ds": "1991-01-01",
      "y": 14770.0
    },
    {
      "ds": "1992-01-01",
      "y": 15500.0
    },
    {
      "ds": "1993-01-01",
      "y": 18283.0
    },
    {
      "ds": "1994-01-01",
      "y": 26390.0
    },
    {
      "ds": "1995-01-01",
      "y": 37666.0
    },
    {
      "ds": "1996-01-01",
      "y": 45288.0
    },
    {
      "ds": "1997-01-01",
      "y": 51552.0
    },
    {
      "ds": "1998-01-01",
      "y": 55729.0
    },
    {
      "ds": "1999-01-01",
      "y": 63919.0
    },
    {
      "ds": "2000-01-01",
      "y": 71440.0
    },
    {
      "ds": "2001-01-01",
      "y": 77151.0
    },
    {
      "ds": "2002-01-01",
      "y": 80377.0
    },
    {
      "ds": "2003-01-01",
      "y": 93989.0
    },
    {
      "ds": "2004-01-01",
      "y": 113991.0
    },
    {
      "ds": "2005-01-01",
      "y": 87264.0
    },
    {
      "ds": "2006-01-01",
      "y": 107995.0
    },
    {
      "ds": "2007-01-01",
      "y": 125158.0
    },
    {
      "ds": "2008-01-01",
      "y": 116821.0
    },
    {
      "ds": "2009-01-01",
      "y": 105950.0
    },
    {
      "ds": "2010-01-01",
      "y": 114158.0
    },
    {
      "ds": "2011-01-01",
      "y": 104508.0
    },
    {
      "ds": "2012-01-01",
      "y": 91776.0
    },
    {
      "ds": "2013-01-01",
      "y": 85869.0
    },
    {
      "ds": "2014-01-01",
      "y": 88704.0
    },
    {
      "ds": "2015-01-01",
      "y": 92775.0
    },
    {
      "ds": "2016-01-01",
      "y": 101843.0
    },
    {
      "ds": "2017-01-01",
      "y": 103977.0
    },
    {
      "ds": "2018-01-01",
      "y": 114602.0
    },
    {
      "ds": "2019-01-01",
      "y": 126199.0
    },
    {
      "ds": "2020-01-01",
      "y": 52720.0
    },
    {
      "ds": "2021-01-01",
      "y": 62777.0
    },
    {
      "ds": "2022-01-01",
      "y": 179309.0
    },
    {
      "ds": "2023-01-01",
      "y": 155994.0
    },
    {
      "ds": "2024-01-01",
      "y": 181645.0
    },
    {
      "ds": "2025-01-01",
      "y": 202172.0
    }
  ],
  "lineage": {
    "runId": "bb001be4-1a76-44f8-9912-d011385405e6",
    "gitSha": "47d557c",
    "inputHash": "sha256:f6bc6175d22d7d71f59c507b87cb97d230234f675c580232a7a78187d02fa8dc"
  }
}
