{
  "schemaVersion": "1.0.0",
  "metric": "bednights_resorts",
  "geo": "MV",
  "freq": "A",
  "unit": "bednights",
  "points": [
    {
      "ds": "1988-01-01",
      "y": 1506656.0
    },
    {
      "ds": "1989-01-01",
      "y": 1461732.0
    },
    {
      "ds": "1990-01-01",
      "y": 1681723.0
    },
    {
      "ds": "1991-01-01",
      "y": 1724742.0
    },
    {
      "ds": "1992-01-01",
      "y": 1974710.0
    },
    {
      "ds": "1993-01-01",
      "y": 2092298.0
    },
    {
      "ds": "1994-01-01",
      "y": 2350803.0
    },
    {
      "ds": "1995-01-01",
      "y": 2725064.3
    },
    {
      "ds": "1996-01-01",
      "y": 3038698.0
    },
    {
      "ds": "1997-01-01",
      "y": 3271043.0
    },
    {
      "ds": "1998-01-01",
      "y": 3466549.0
    },
    {
      "ds": "1999-01-01",
      "y": 3718207.0
    },
    {
      "ds": "2000-01-01",
      "y": 3882333.0
    },
    {
      "ds": "2001-01-01",
      "y": 3863396.0
    },
    {
      "ds": "2002-01-01",
      "y": 3988303.0
    },
    {
      "ds": "2003-01-01",
      "y": 4617672.0
    },
    {
      "ds": "2004-01-01",
      "y": 4986956.3
    },
    {
      "ds": "2005-01-01",
      "y": 3195980.0
    },
    {
      "ds": "2006-01-01",
      "y": 4711532.8
    },
    {
      "ds": "2007-01-01",
      "y": 5148329.0
    },
    {
      "ds": "2008-01-01",
      "y": 5285297.0
    },
    {
      "ds": "2009-01-01",
      "y": 5008811.0
    },
    {
      "ds": "2010-01-01",
      "y": 5645488.0
    },
    {
      "ds": "2011-01-01",
      "y": 6144975.0
    },
    {
      "ds": "2012-01-01",
      "y": 6139149.0
    },
    {
      "ds": "2013-01-01",
      "y": 6673231.0
    },
    {
      "ds": "2014-01-01",
      "y": 6864861.0
    },
    {
      "ds": "2015-01-01",
      "y": 6489783.359999999
    },
    {
      "ds": "2016-01-01",
      "y": 6645765.0
    },
    {
      "ds": "2017-01-01",
      "y": 7343577.0649094805
    },
    {
      "ds": "2018-01-01",
      "y": 8000049.21867242
    },
    {
      "ds": "2019-01-01",
      "y": 8997786.585998569
    },
    {
      "ds": "2020-01-01",
      "y": 3357345.18568527
    },
    {
      "ds": "2021-01-01",
      "y": 8602827.795716934
    },
    {
      "ds": "2022-01-01",
      "y": 10350102.205788644
    },
    {
      "ds": "2023-01-01",
      "y": 10124539.323674459
    },
    {
      "ds": "2024-01-01",
      "y": 10958966.113920437
    },
    {
      "ds": "2025-01-01",
      "y": 10939140.759580944
    }
  ],
  "lineage": {
    "runId": "55a618f7-7c09-4350-8567-a0ea9ae74616",
    "gitSha": "d73b74c",
    "inputHash": "sha256:4dd991b265c91f700ca74d3356c845863385751e99620b3fefc9edd73a19e061"
  }
}
