{
  "schemaVersion": "1.0.0",
  "metric": "arrivals_total_annual",
  "geo": "MV",
  "freq": "A",
  "unit": "arrivals",
  "points": [
    {
      "ds": "1988-01-01",
      "y": 155757.0
    },
    {
      "ds": "1989-01-01",
      "y": 158488.0
    },
    {
      "ds": "1990-01-01",
      "y": 195156.0
    },
    {
      "ds": "1991-01-01",
      "y": 196112.0
    },
    {
      "ds": "1992-01-01",
      "y": 235852.0
    },
    {
      "ds": "1993-01-01",
      "y": 241020.0
    },
    {
      "ds": "1994-01-01",
      "y": 279982.0
    },
    {
      "ds": "1995-01-01",
      "y": 314869.0
    },
    {
      "ds": "1996-01-01",
      "y": 338733.0
    },
    {
      "ds": "1997-01-01",
      "y": 365563.0
    },
    {
      "ds": "1998-01-01",
      "y": 395725.0
    },
    {
      "ds": "1999-01-01",
      "y": 429666.0
    },
    {
      "ds": "2000-01-01",
      "y": 467154.0
    },
    {
      "ds": "2001-01-01",
      "y": 460984.0
    },
    {
      "ds": "2002-01-01",
      "y": 484680.0
    },
    {
      "ds": "2003-01-01",
      "y": 563593.0
    },
    {
      "ds": "2004-01-01",
      "y": 616716.0
    },
    {
      "ds": "2005-01-01",
      "y": 395320.0
    },
    {
      "ds": "2006-01-01",
      "y": 601923.0
    },
    {
      "ds": "2007-01-01",
      "y": 675889.0
    },
    {
      "ds": "2008-01-01",
      "y": 683012.0
    },
    {
      "ds": "2009-01-01",
      "y": 655852.0
    },
    {
      "ds": "2010-01-01",
      "y": 791917.0
    },
    {
      "ds": "2011-01-01",
      "y": 931333.0
    },
    {
      "ds": "2012-01-01",
      "y": 958027.0
    },
    {
      "ds": "2013-01-01",
      "y": 1125202.0
    },
    {
      "ds": "2014-01-01",
      "y": 1204857.0
    },
    {
      "ds": "2015-01-01",
      "y": 1234248.0
    },
    {
      "ds": "2016-01-01",
      "y": 1286135.0
    },
    {
      "ds": "2017-01-01",
      "y": 1389542.0
    },
    {
      "ds": "2018-01-01",
      "y": 1484274.0
    },
    {
      "ds": "2019-01-01",
      "y": 1702887.0
    },
    {
      "ds": "2020-01-01",
      "y": 555494.0
    },
    {
      "ds": "2021-01-01",
      "y": 1321937.0
    },
    {
      "ds": "2022-01-01",
      "y": 1675303.0
    },
    {
      "ds": "2023-01-01",
      "y": 1878543.0
    },
    {
      "ds": "2024-01-01",
      "y": 2046615.0
    },
    {
      "ds": "2025-01-01",
      "y": 2246516.0
    }
  ],
  "lineage": {
    "runId": "b9bf2337-bd9f-4476-8df9-6a9a6b3fcebc",
    "gitSha": "b0e45d1",
    "inputHash": "sha256:aea8459310c044f0daf4bff23e9e925b344bed12c53cdd50c8623c36a2ac618d"
  }
}
