{
  "schemaVersion": "1.0.0",
  "metric": "arrivals_russia",
  "geo": "MV",
  "freq": "A",
  "unit": "arrivals",
  "points": [
    {
      "ds": "1993-01-01",
      "y": 149.0
    },
    {
      "ds": "1994-01-01",
      "y": 1024.0
    },
    {
      "ds": "1995-01-01",
      "y": 2700.0
    },
    {
      "ds": "1996-01-01",
      "y": 5525.0
    },
    {
      "ds": "1997-01-01",
      "y": 4904.0
    },
    {
      "ds": "1998-01-01",
      "y": 4166.0
    },
    {
      "ds": "1999-01-01",
      "y": 3428.0
    },
    {
      "ds": "2000-01-01",
      "y": 3608.0
    },
    {
      "ds": "2001-01-01",
      "y": 3983.0
    },
    {
      "ds": "2002-01-01",
      "y": 7550.0
    },
    {
      "ds": "2003-01-01",
      "y": 12108.0
    },
    {
      "ds": "2004-01-01",
      "y": 18075.0
    },
    {
      "ds": "2005-01-01",
      "y": 14582.0
    },
    {
      "ds": "2006-01-01",
      "y": 21955.0
    },
    {
      "ds": "2007-01-01",
      "y": 31845.0
    },
    {
      "ds": "2008-01-01",
      "y": 48978.0
    },
    {
      "ds": "2009-01-01",
      "y": 40014.0
    },
    {
      "ds": "2010-01-01",
      "y": 49111.0
    },
    {
      "ds": "2011-01-01",
      "y": 63936.0
    },
    {
      "ds": "2012-01-01",
      "y": 66378.0
    },
    {
      "ds": "2013-01-01",
      "y": 76479.0
    },
    {
      "ds": "2014-01-01",
      "y": 66308.0
    },
    {
      "ds": "2015-01-01",
      "y": 44323.0
    },
    {
      "ds": "2016-01-01",
      "y": 46522.0
    },
    {
      "ds": "2017-01-01",
      "y": 61931.0
    },
    {
      "ds": "2018-01-01",
      "y": 70935.0
    },
    {
      "ds": "2019-01-01",
      "y": 83369.0
    },
    {
      "ds": "2020-01-01",
      "y": 61387.0
    },
    {
      "ds": "2021-01-01",
      "y": 222422.0
    },
    {
      "ds": "2022-01-01",
      "y": 201954.0
    },
    {
      "ds": "2023-01-01",
      "y": 209146.0
    },
    {
      "ds": "2024-01-01",
      "y": 225204.0
    },
    {
      "ds": "2025-01-01",
      "y": 278761.0
    }
  ],
  "lineage": {
    "runId": "5a177035-0c1c-4d32-8d8c-8062a7644835",
    "gitSha": "47d557c",
    "inputHash": "sha256:53a246671156b1f4adec4f687f4e74016c239f86f431edf1ff0350499868bf3b"
  }
}
