{
  "schemaVersion": "1.0.0",
  "metric": "arrivals_total",
  "geo": "MV",
  "freq": "M",
  "unit": "arrivals",
  "points": [
    {
      "ds": "2021-01-01",
      "y": 92103.0
    },
    {
      "ds": "2021-02-01",
      "y": 96882.0
    },
    {
      "ds": "2021-03-01",
      "y": 109585.0
    },
    {
      "ds": "2021-04-01",
      "y": 91200.0
    },
    {
      "ds": "2021-05-01",
      "y": 64613.0
    },
    {
      "ds": "2021-06-01",
      "y": 56166.0
    },
    {
      "ds": "2021-07-01",
      "y": 101818.0
    },
    {
      "ds": "2021-08-01",
      "y": 143599.0
    },
    {
      "ds": "2021-09-01",
      "y": 114896.0
    },
    {
      "ds": "2021-10-01",
      "y": 142066.0
    },
    {
      "ds": "2021-11-01",
      "y": 144725.0
    },
    {
      "ds": "2021-12-01",
      "y": 164284.0
    },
    {
      "ds": "2022-01-01",
      "y": 131764.0
    },
    {
      "ds": "2022-02-01",
      "y": 149008.0
    },
    {
      "ds": "2022-03-01",
      "y": 150748.0
    },
    {
      "ds": "2022-04-01",
      "y": 145280.0
    },
    {
      "ds": "2022-05-01",
      "y": 125522.0
    },
    {
      "ds": "2022-06-01",
      "y": 110889.0
    },
    {
      "ds": "2022-07-01",
      "y": 133561.0
    },
    {
      "ds": "2022-08-01",
      "y": 131862.0
    },
    {
      "ds": "2022-09-01",
      "y": 111986.0
    },
    {
      "ds": "2022-10-01",
      "y": 153737.0
    },
    {
      "ds": "2022-11-01",
      "y": 146886.0
    },
    {
      "ds": "2022-12-01",
      "y": 184051.0
    },
    {
      "ds": "2023-01-01",
      "y": 172499.0
    },
    {
      "ds": "2023-02-01",
      "y": 177915.0
    },
    {
      "ds": "2023-03-01",
      "y": 173514.0
    },
    {
      "ds": "2023-04-01",
      "y": 164357.0
    },
    {
      "ds": "2023-05-01",
      "y": 120959.0
    },
    {
      "ds": "2023-06-01",
      "y": 120363.0
    },
    {
      "ds": "2023-07-01",
      "y": 145620.0
    },
    {
      "ds": "2023-08-01",
      "y": 154854.0
    },
    {
      "ds": "2023-09-01",
      "y": 130967.0
    },
    {
      "ds": "2023-10-01",
      "y": 159141.0
    },
    {
      "ds": "2023-11-01",
      "y": 163658.0
    },
    {
      "ds": "2023-12-01",
      "y": 194696.0
    },
    {
      "ds": "2024-01-01",
      "y": 192385.0
    },
    {
      "ds": "2024-02-01",
      "y": 217392.0
    },
    {
      "ds": "2024-03-01",
      "y": 194227.0
    },
    {
      "ds": "2024-04-01",
      "y": 168366.0
    },
    {
      "ds": "2024-05-01",
      "y": 119875.0
    },
    {
      "ds": "2024-06-01",
      "y": 123284.0
    },
    {
      "ds": "2024-07-01",
      "y": 167528.0
    },
    {
      "ds": "2024-08-01",
      "y": 176175.0
    },
    {
      "ds": "2024-09-01",
      "y": 132795.0
    },
    {
      "ds": "2024-10-01",
      "y": 172621.0
    },
    {
      "ds": "2024-11-01",
      "y": 172987.0
    },
    {
      "ds": "2024-12-01",
      "y": 208980.0
    },
    {
      "ds": "2025-01-01",
      "y": 214863.0
    },
    {
      "ds": "2025-02-01",
      "y": 214091.0
    },
    {
      "ds": "2025-03-01",
      "y": 203468.0
    },
    {
      "ds": "2025-04-01",
      "y": 198322.0
    },
    {
      "ds": "2025-05-01",
      "y": 135614.0
    },
    {
      "ds": "2025-06-01",
      "y": 141772.0
    },
    {
      "ds": "2025-07-01",
      "y": 186738.0
    },
    {
      "ds": "2025-08-01",
      "y": 192058.0
    },
    {
      "ds": "2025-09-01",
      "y": 149563.0
    },
    {
      "ds": "2025-10-01",
      "y": 190445.0
    },
    {
      "ds": "2025-11-01",
      "y": 195127.0
    },
    {
      "ds": "2025-12-01",
      "y": 224455.0
    },
    {
      "ds": "2026-01-01",
      "y": 224788.0
    },
    {
      "ds": "2026-02-01",
      "y": 247722.0
    },
    {
      "ds": "2026-03-01",
      "y": 161259.0
    }
  ],
  "lineage": {
    "runId": "9ff72624-14e0-435f-97ac-7e3c3dd64dda",
    "gitSha": "73c145c",
    "inputHash": "sha256:1e18d24ce00d78aa7d33179a5ac062c276e9d97f3d2681d303db73f9e3b83c41"
  }
}
