{
  "schemaVersion": "1.0.0",
  "metric": "arrivals_italy",
  "geo": "MV",
  "freq": "A",
  "unit": "arrivals",
  "points": [
    {
      "ds": "1988-01-01",
      "y": 28329.0
    },
    {
      "ds": "1989-01-01",
      "y": 30945.0
    },
    {
      "ds": "1990-01-01",
      "y": 39808.0
    },
    {
      "ds": "1991-01-01",
      "y": 38439.0
    },
    {
      "ds": "1992-01-01",
      "y": 49149.0
    },
    {
      "ds": "1993-01-01",
      "y": 46229.0
    },
    {
      "ds": "1994-01-01",
      "y": 45874.0
    },
    {
      "ds": "1995-01-01",
      "y": 52105.0
    },
    {
      "ds": "1996-01-01",
      "y": 53932.0
    },
    {
      "ds": "1997-01-01",
      "y": 55443.0
    },
    {
      "ds": "1998-01-01",
      "y": 79301.0
    },
    {
      "ds": "1999-01-01",
      "y": 88697.0
    },
    {
      "ds": "2000-01-01",
      "y": 106451.0
    },
    {
      "ds": "2001-01-01",
      "y": 115740.0
    },
    {
      "ds": "2002-01-01",
      "y": 114955.0
    },
    {
      "ds": "2003-01-01",
      "y": 140304.0
    },
    {
      "ds": "2004-01-01",
      "y": 131044.0
    },
    {
      "ds": "2005-01-01",
      "y": 70115.0
    },
    {
      "ds": "2006-01-01",
      "y": 118929.0
    },
    {
      "ds": "2007-01-01",
      "y": 117246.0
    },
    {
      "ds": "2008-01-01",
      "y": 103823.0
    },
    {
      "ds": "2009-01-01",
      "y": 89292.0
    },
    {
      "ds": "2010-01-01",
      "y": 89621.0
    },
    {
      "ds": "2011-01-01",
      "y": 83328.0
    },
    {
      "ds": "2012-01-01",
      "y": 62782.0
    },
    {
      "ds": "2013-01-01",
      "y": 57854.0
    },
    {
      "ds": "2014-01-01",
      "y": 57862.0
    },
    {
      "ds": "2015-01-01",
      "y": 65616.0
    },
    {
      "ds": "2016-01-01",
      "y": 71202.0
    },
    {
      "ds": "2017-01-01",
      "y": 88867.0
    },
    {
      "ds": "2018-01-01",
      "y": 105297.0
    },
    {
      "ds": "2019-01-01",
      "y": 136343.0
    },
    {
      "ds": "2020-01-01",
      "y": 46690.0
    },
    {
      "ds": "2021-01-01",
      "y": 27309.0
    },
    {
      "ds": "2022-01-01",
      "y": 97627.0
    },
    {
      "ds": "2023-01-01",
      "y": 118525.0
    },
    {
      "ds": "2024-01-01",
      "y": 145672.0
    },
    {
      "ds": "2025-01-01",
      "y": 153414.0
    }
  ],
  "lineage": {
    "runId": "199b931d-fc0d-425a-b6a9-e84f121cae19",
    "gitSha": "47d557c",
    "inputHash": "sha256:08036b3fb0f8c5aef6f77fe8525d9753839964a6e1eb88a3e9f5eda994e65655"
  }
}
