{
  "schemaVersion": "1.0.0",
  "metric": "bednights_guesthouses",
  "geo": "MV",
  "freq": "A",
  "unit": "bednights",
  "points": [
    {
      "ds": "2010-01-01",
      "y": 27616.0
    },
    {
      "ds": "2011-01-01",
      "y": 27577.0
    },
    {
      "ds": "2012-01-01",
      "y": 47953.976085523725
    },
    {
      "ds": "2013-01-01",
      "y": 97624.71919524555
    },
    {
      "ds": "2014-01-01",
      "y": 160804.69303973988
    },
    {
      "ds": "2015-01-01",
      "y": 331839.6707719641
    },
    {
      "ds": "2016-01-01",
      "y": 644472.9257402574
    },
    {
      "ds": "2017-01-01",
      "y": 754244.8539376748
    },
    {
      "ds": "2018-01-01",
      "y": 944521.3961435261
    },
    {
      "ds": "2019-01-01",
      "y": 1129458.2920919799
    },
    {
      "ds": "2020-01-01",
      "y": 408938.59676497255
    },
    {
      "ds": "2021-01-01",
      "y": 1060727.1062062758
    },
    {
      "ds": "2022-01-01",
      "y": 1448854.6725618986
    },
    {
      "ds": "2023-01-01",
      "y": 2291260.325939683
    },
    {
      "ds": "2024-01-01",
      "y": 1899533.107253807
    },
    {
      "ds": "2025-01-01",
      "y": 2209535.4988011923
    }
  ],
  "lineage": {
    "runId": "83952712-6dba-4824-969e-ae25876b9e58",
    "gitSha": "d73b74c",
    "inputHash": "sha256:2a0e8286ec30b66604af5819a7330adfb229398172e71ac99976baf169f5db02"
  }
}
