{
  "schemaVersion": "1.0.0",
  "metric": "bednights_safari",
  "geo": "MV",
  "freq": "A",
  "unit": "bednights",
  "points": [
    {
      "ds": "2010-01-01",
      "y": 129137.0
    },
    {
      "ds": "2011-01-01",
      "y": 143045.0
    },
    {
      "ds": "2012-01-01",
      "y": 245616.5510280368
    },
    {
      "ds": "2013-01-01",
      "y": 265012.5028197804
    },
    {
      "ds": "2014-01-01",
      "y": 256239.5693387594
    },
    {
      "ds": "2015-01-01",
      "y": 296621.03790606547
    },
    {
      "ds": "2016-01-01",
      "y": 263842.71629756346
    },
    {
      "ds": "2017-01-01",
      "y": 256373.618963063
    },
    {
      "ds": "2018-01-01",
      "y": 277720.4922339101
    },
    {
      "ds": "2019-01-01",
      "y": 276239.5026569018
    },
    {
      "ds": "2020-01-01",
      "y": 118380.7227218985
    },
    {
      "ds": "2021-01-01",
      "y": 196619.3476217186
    },
    {
      "ds": "2022-01-01",
      "y": 258548.68608797944
    },
    {
      "ds": "2023-01-01",
      "y": 262683.0000136667
    },
    {
      "ds": "2024-01-01",
      "y": 277735.01899794774
    },
    {
      "ds": "2025-01-01",
      "y": 276650.9847672754
    }
  ],
  "lineage": {
    "runId": "d92d0082-56a8-47bb-b59e-7459f32e3836",
    "gitSha": "d73b74c",
    "inputHash": "sha256:c209a8189c77e26174667dfb5bde40971c37bd8804e9a9c461545c964aa8531a"
  }
}
