{
  "schemaVersion": "1.0.0",
  "metric": "arrivals_china",
  "geo": "MV",
  "freq": "A",
  "unit": "arrivals",
  "points": [
    {
      "ds": "1992-01-01",
      "y": 18525.0
    },
    {
      "ds": "1993-01-01",
      "y": 10485.0
    },
    {
      "ds": "1994-01-01",
      "y": 12174.0
    },
    {
      "ds": "1995-01-01",
      "y": 9363.0
    },
    {
      "ds": "1996-01-01",
      "y": 5366.0
    },
    {
      "ds": "1997-01-01",
      "y": 3383.0
    },
    {
      "ds": "1998-01-01",
      "y": 3259.0
    },
    {
      "ds": "1999-01-01",
      "y": 3973.0
    },
    {
      "ds": "2000-01-01",
      "y": 5380.0
    },
    {
      "ds": "2001-01-01",
      "y": 7342.0
    },
    {
      "ds": "2002-01-01",
      "y": 12383.0
    },
    {
      "ds": "2003-01-01",
      "y": 15021.0
    },
    {
      "ds": "2004-01-01",
      "y": 20599.0
    },
    {
      "ds": "2005-01-01",
      "y": 11609.0
    },
    {
      "ds": "2006-01-01",
      "y": 26396.0
    },
    {
      "ds": "2007-01-01",
      "y": 37994.0
    },
    {
      "ds": "2008-01-01",
      "y": 43744.0
    },
    {
      "ds": "2009-01-01",
      "y": 62641.0
    },
    {
      "ds": "2010-01-01",
      "y": 122792.0
    },
    {
      "ds": "2011-01-01",
      "y": 203960.0
    },
    {
      "ds": "2012-01-01",
      "y": 233981.0
    },
    {
      "ds": "2013-01-01",
      "y": 338241.0
    },
    {
      "ds": "2014-01-01",
      "y": 370967.0
    },
    {
      "ds": "2015-01-01",
      "y": 368691.0
    },
    {
      "ds": "2016-01-01",
      "y": 333831.0
    },
    {
      "ds": "2017-01-01",
      "y": 316856.0
    },
    {
      "ds": "2018-01-01",
      "y": 295555.0
    },
    {
      "ds": "2019-01-01",
      "y": 299001.0
    },
    {
      "ds": "2020-01-01",
      "y": 36873.0
    },
    {
      "ds": "2021-01-01",
      "y": 2424.0
    },
    {
      "ds": "2022-01-01",
      "y": 15023.0
    },
    {
      "ds": "2023-01-01",
      "y": 187125.0
    },
    {
      "ds": "2024-01-01",
      "y": 263340.0
    },
    {
      "ds": "2025-01-01",
      "y": 329110.0
    }
  ],
  "lineage": {
    "runId": "6f401da6-7e0d-4d36-a1e7-3aabef87dbf3",
    "gitSha": "47d557c",
    "inputHash": "sha256:4122916718cf3b1baa58b1d08e1a78d3c7b8dfe816f49046b2edf299bec4ceb0"
  }
}
